<?xml version="1.0" encoding="UTF-8"?>
<!DOCTYPE receta SYSTEM "ejercicio5.dtd">

<receta>
<nombre_plato>Paella</nombre_plato>
<fotografia foto="foto1 foto2"></fotografia>

<ingredientes>
<ingrediente>Arroz</ingrediente>

</ingredientes>

<pasos>

<paso orden="1">lol1</paso>

<paso orden="2">lol2</paso>


</pasos>

</receta>
















